query,doc_index
Why is Australia's monetary policy still seen as powerful even though a lot of households have high mortgage debt?,551
"What's Palo Alto Networks' revenue forecast for the second quarter, and how does it stack up against what analysts expected?",400
How could institutional investments affect Bitcoin's price through 2025?,377
"Hey, I've been hearing that some AI companies are getting into hardware. What challenges do these companies face when trying to bring AI devices to market?",240
"What impact could increased tariffs have on the cost of goods for companies, and how might that affect consumers?",516
"Why is the U.S. government reducing Intel's chips grant, and what factors are contributing to the change?",345
"What is Israel considering regarding a cease-fire with Hezbollah, and what would the terms be?",213
"How have Baidu's shares performed this year, and what’s the outlook for its upcoming earnings report?",370
"What challenges does the U.S. face in reaching an agreement over the future of Colorado River water use, and what are the possible solutions being discussed?",554
Why are creditors frustrated with the stalled auction of Citgo Petroleum shares?,276
"How did Zoom's third-quarter results compare to analyst expectations, and what challenges is the company facing in maintaining its customer base?",51
"How do geopolitical risks, valuation mismatches, and economic conditions affect the IPO landscape in Spain?",299
"Why is Ford planning to reduce its workforce in Europe and the U.K., and what are the challenges it faces in the electric vehicle market?",567
"What's going on with Ricardo Salinas Pliego's financial situation, and why is Grupo Elektra's stock trading halt causing so many issues?",234
Why do experts believe Russia may not be able to sustain its war in Ukraine beyond 2025?,354
"What are the key players in the brain-computer interface market, and how are they competing to be the first to launch commercially?",519
"What strategies are airlines using to attract premium passengers, and how is this affecting their financial performance?",495
How is Pocket FM using AI to expand its content library and improve production efficiency?,28
"What is SoftBank's plan to acquire shares in OpenAI, and how does this fit into its broader investment strategy in AI?",55
"What factors are influencing the FHFA's decision to raise the conforming loan limit, and what does this mean for the real estate market?",170
"How does New Lantern plan to disrupt the radiology software market, and what impact could it have on the industry?",421
"How is Dell's AI server business performing, and what impact have delays in Nvidia's Blackwell AI chips had on its revenue?",58
How did the potential cease-fire between Israel and Hezbollah affect oil prices?,167
What impact is the decline in recession fears and growing optimism about jobs and finances having on consumer confidence and spending patterns?,287
"What are the main reasons why FIS and Fiserv are seeing significant stock growth, and what outlook do analysts have for these companies in the coming years?",311
